{"acceptance":{"all_compiler_factors_orthogonal_symplectic":true,"analytic_global_gap":true,"current_raw_weave_integration":false,"independent_second_chern_estimators":true,"lean_kernel_check":false,"listener_study":false,"model_python_replay":true,"one_second_adiabatic_theorem_budget":false,"one_second_numerical_adiabatic_replay":true,"passive_radiation_energy_closure":true,"persistent_state_required":true,"production_rust_replay":false,"protected_preparation_from_string_port":true,"room_feedback_causal":true},"artifacts":{"audio":{"AB":"unified-protected-ab.wav","AB_level_matched":"unified-protected-ab-level-matched.wav","BA":"unified-protected-ba.wav","BA_level_matched":"unified-protected-ba-level-matched.wav"},"compiled_words":{"path":"unified_compiled_words.json","sha256":"a100d4e8c3fce8b174e37c5c8e25d92a914cabf86097b26ed17dec8b7d53cd7e"},"operator_tables":{"contents":["path points and projectors","full and occupied holonomies","regional mixer","fixed preparation/readout calibrations","physical radiation-port maps"],"path":"unified_operator_tables.npz","sha256":"a5a7b1c53c437f22fe56bee0be740cb181d71268ca10d9db73980cb3c38fb897"},"results":{"path":"unified_results.json","sha256":"1994c5a5d258f49b958585f26c877420cb46a8ce440f914d3127e00d708f17db"}},"audibility":{"causal_carrier":"persistent protected state -> fixed readout calibration -> passive room port","gain_removed_waveform_distance":1.403916262996598,"level_matched_control_pair":["unified-protected-ab-level-matched.wav","unified-protected-ba-level-matched.wav"],"listener_discrimination_claimed":false,"normalized_spectral_magnitude_distance":0.13513329803908697,"optimal_scalar_residual_fraction":0.9998947307463854,"relative_rms_waveform_distance":1.3788461636078428,"shared_gain_pair":["unified-protected-ab.wav","unified-protected-ba.wav"],"sidecar_oscillator_bank":false,"spectral_matching_claimed":false},"claim":{"evidence_classes":["theorem","validated_numerics","reference_oracle"],"production_level":null,"reference_level":"protected-acoustic","satisfied_gates":["order-dependent","closed-control","geometric","gapped-family","topological-bundle","protected-acoustic"],"scope":"The reference model may carry a protected-acoustic oracle claim while production remains unpromoted until independent Rust/Weave replay and formal checks pass.","withheld_stronger_claims":{"adiabatic-realization":"finite-time replay exists, but the requested rigorous duration/error budget is not accepted","fault-tolerant":"no error-correcting or fault-tolerance mechanism","listener-evidence":"audible files exist, but no blinded listener result","production-promotion":"Python reference is not yet independently replayed by production Rust/Weave and Lean"}},"controls":{"A":{"axes":[2,3],"base":[-0.4,0.0,0.9,-0.7],"certificate":{"determinant_error":5.226309294643549e-15,"endpoint_projector_error_fro":0.0,"full_unitarity_error_fro":7.766248332903755e-14,"maximum_adjacent_projector_distance_op":0.02620707554488202,"minimum_gap":2.090545961996016,"minimum_transition_singular_value":0.9996565356117991,"name":"A","occupied_eigenphases":[-0.9219696358205642,0.9219696358205653],"occupied_unitarity_error_fro":8.5148482535631e-15,"points":257,"rank":2,"trace_imag":-1.4432899320127035e-15,"trace_real":1.2085038741564202,"transport_intertwining_error_fro":6.871252174144892e-15},"eased_quintic":true,"name":"A","path_projector_digest_sha256":"24e4d451a74b60b8e6a971140acea5d647498c744a352892b2b8ed00b5fcbe44","points":257,"radii":[1.5,1.2]},"B":{"axes":[0,3],"base":[-0.4,0.0,0.9,-0.7],"certificate":{"determinant_error":1.887379141862766e-15,"endpoint_projector_error_fro":0.0,"full_unitarity_error_fro":6.719885898267653e-14,"maximum_adjacent_projector_distance_op":0.021674930354762974,"minimum_gap":2.000149104780226,"minimum_transition_singular_value":0.9997650711012643,"name":"B","occupied_eigenphases":[-0.8602818492391705,0.8602818492391705],"occupied_unitarity_error_fro":1.4900209768504074e-14,"points":257,"rank":2,"trace_imag":5.717648576819556e-15,"trace_real":1.3044476898052566,"transport_intertwining_error_fro":7.458059988364207e-15},"eased_quintic":true,"name":"B","path_projector_digest_sha256":"db3ad3205559c2fed459d1d750e41825a4869d5e356163102f93440103e202fd","points":257,"radii":[1.3,1.0]},"basepoint":[-0.4,0.0,0.9,-0.7],"control_map":{"coordinates":["k1","k2","k3","k4"],"detuning":"(-3+sum_i cos(k_i)) Gamma_5","period":6.283185307179586,"physical_interpretation":"four cyclic I/Q coupler phases in the protected modal backbone; not a claim about passive mechanical knobs","signed_couplers":"sin(k_i) Gamma_i"},"gauge_covariance":{"commutator_norm_error":0.0,"determinant_error":4.440892098500626e-16,"eigenphase_error":1.1102230246251565e-16,"loop_matrix_covariance_error_fro":3.050944142796875e-16,"trace_error":2.220446049250313e-16},"nonabelian":{"commutator_fro":1.6877009280334596,"commutator_operator_norm":1.193384770827292,"exact_coupling_homotopy_lower_bound_fro":1.6877009280334596,"group_commutator_distance_fro":1.6877009280334594,"trace_commutator_imag":-1.1102230246251565e-16,"trace_commutator_real":0.0,"wider_parameter_box_status":"C2 and rank are analytically certified over the coefficient box; this particular Wilson commutator is only empirically swept there."},"path_laws":{"A":{"coarse_fine_error_fro":0.0010610511732684418,"concatenation_error_fro":1.2721326961124708e-14,"identity_error_fro":1.0817391563639537e-14,"reversal_error_fro":1.008324158022778e-13,"richardson_estimator_fro":0.0010610511732684418},"B":{"coarse_fine_error_fro":0.0007249868833861935,"concatenation_error_fro":1.5111494778704767e-14,"identity_error_fro":1.0710174916112635e-14,"reversal_error_fro":1.0327235781933242e-13,"richardson_estimator_fro":0.0007249868833861935}},"same_basepoint":true},"epistemic_claim":{"evidence_classes":["theorem","validated_numerics","reference_oracle"],"maximum_production_claim":null,"maximum_reference_claim":"protected-acoustic","promoted":["order-dependent","closed-control","geometric","gapped-family","topological-bundle","protected-acoustic"],"refused":{"adiabatic-realization":"finite-time replay exists, but the requested rigorous duration/error budget is not accepted","fault-tolerant":"no error-correcting or fault-tolerance mechanism","listener-evidence":"audible files exist, but no blinded listener result","production-promotion":"Python reference is not yet independently replayed by production Rust/Weave and Lean"},"scope":"The reference model may carry a protected-acoustic oracle claim while production remains unpromoted until independent Rust/Weave replay and formal checks pass."},"family":{"basis":"region-major positive-frequency complex power-wave amplitudes","complex_dimension":16,"complex_structure":"standard J on [Re z, Im z]","control_period":6.283185307179586,"coupling_homotopy":{"decoupled_limit":"s=0","full_coupling":"s=1","gap_preserved_exactly":true,"isospectral":true,"parameter":"s in [0,1]"},"energy_convention":"E=z^*z in energy-normalized power-wave coordinates","family_digest_sha256":"4964ab5a4cc277193776fd6ae9c062308e10b14abd33984cfe0152eec09a0dbd","formula":"K_s(k)=V_s diag(sum_i sin(k_i) Gamma_i + (m+sum_i cos(k_i)) Gamma_5, 9 I4, 11 I4, 13 I4) V_s^*","internal_channels_per_region":4,"metric":"identity","operator_category":"finite-dimensional self-adjoint complex acoustic modal family","parameters":{"carrier_hz":440.0,"coupling_fraction":1.0,"dirac_scale_hz":20.0,"mass":-3.0,"trivial_offsets":[9.0,11.0,13.0]},"real_dimension":32,"realification":"R(U)=[[Re U,-Im U],[Im U,Re U]]","regional_participation":[0.2500000000000001,0.25,0.25,0.24999999999999992],"regions":["string","body","near_field","late_room"],"symmetry":{"boundary":"ordinary bosonic reciprocity is not asserted; complex I/Q digital couplers or an equivalent active implementation are required","effective":"antiunitary pseudo-time-reversal T^2=-1","residual":0.0,"square_residual":0.0},"underlying_real_characteristic_class":"c1=0 for the occupied SU(2) doublet; under the declared orientation, p1(E_R)=-2 c2(E)"},"finite_time":{"minimum_sufficient_duration_seconds":{"A":22.362855480397428,"B":15.941498262892383},"numerical_replays":{"0.25":{"A":{"active_unitarity_error_fro":1.5523604462879308e-14,"duration_seconds":0.25,"host_block_invariance_basis":"exact equality of the absolute sample-index sequence under every declared host-block partition; production cross-runtime replay pending","host_block_invariance_error_fro":0.0,"jrs":{"accepted":false,"dimensionless_duration":31.41592653589793,"jrs_numerator":140.5099649810136,"loop":"A","maximum_h_prime":18.174053830885523,"maximum_h_second":368.98540266432286,"minimum_gap":2.0904973121035426,"physical_duration_seconds":0.25,"projector_error_upper_bound":4.472571096079486,"requested_budget":0.05,"theorem":"Jansen--Ruskai--Seiler (2007), Theorem 3, finite-dimensional rank-two spectral band; carrier scalar removed.","transition_probability_upper_bound":1.0},"leakage_fro":0.06560772838661302,"loop":"A","projective_holonomy_error_fro":0.022404273858866928,"retained_minimum_singular_value":0.9979385112192896,"sample_rate_hz":12000.0,"samples":3000},"B":{"active_unitarity_error_fro":1.1700967728633877e-14,"duration_seconds":0.25,"host_block_invariance_basis":"exact equality of the absolute sample-index sequence under every declared host-block partition; production cross-runtime replay pending","host_block_invariance_error_fro":0.0,"jrs":{"accepted":false,"dimensionless_duration":31.41592653589793,"jrs_numerator":100.16338765983431,"loop":"B","maximum_h_prime":13.604405331234108,"maximum_h_second":246.48589382684898,"minimum_gap":2.0001135591540695,"physical_duration_seconds":0.25,"projector_error_upper_bound":3.1882996525784764,"requested_budget":0.05,"theorem":"Jansen--Ruskai--Seiler (2007), Theorem 3, finite-dimensional rank-two spectral band; carrier scalar removed.","transition_probability_upper_bound":1.0},"leakage_fro":0.006520547740023216,"loop":"B","projectiv